{
  "format": "reapnes-song-set",
  "version": 1,
  "game": {
    "title": "JourneytoSilius",
    "platform": "NES"
  },
  "song": {
    "title": "04Stage2"
  },
  "provenance": {
    "source": "nes-mdb-extracted",
    "confidence": "approximate",
    "notes": "Auto-generated from NES-MDB corpus. 175 presets found. Best-by-note-count selection."
  },
  "channels": {
    "pulse1": {
      "role": "lead",
      "preset": "jsfx_data/26193_Square_Swell_4041.reapnes-data",
      "description": "Square Swell 4041 (15 notes)",
      "notes": "Tags: pulse, short, attack, square"
    },
    "pulse2": {
      "role": "harmony",
      "preset": "jsfx_data/26335_Swell_38756.reapnes-data",
      "description": "Swell 38756 (14 notes)",
      "notes": "Tags: pulse, staccato, swell, narrow"
    },
    "noise": {
      "role": "percussion",
      "preset": "jsfx_data/48332_Snare_Fade_12791.reapnes-data",
      "description": "Snare Fade 12791 (12 notes)"
    }
  },
  "drum_map": {
    "36": {
      "preset": "jsfx_data/48332_Snare_Fade_12791.reapnes-data",
      "description": "Snare Fade 12791"
    },
    "38": {
      "preset": "jsfx_data/48584_Snare_Fade_13394.reapnes-data",
      "description": "Snare Fade 13394"
    },
    "42": {
      "preset": "jsfx_data/48781_Noise_Swell_13426.reapnes-data",
      "description": "Noise Swell 13426"
    },
    "46": {
      "preset": "jsfx_data/48782_Noise_Swell_13430.reapnes-data",
      "description": "Noise Swell 13430"
    }
  }
}