{
  "format": "reapnes-song-set",
  "version": 1,
  "game": {
    "title": "CastlevaniaIII Dracula sCurse",
    "platform": "NES"
  },
  "song": {
    "title": "14Aquarius"
  },
  "provenance": {
    "source": "nes-mdb-extracted",
    "confidence": "approximate",
    "notes": "Auto-generated from NES-MDB corpus. 15 presets found. Best-by-note-count selection."
  },
  "channels": {
    "pulse1": {
      "role": "lead",
      "preset": "jsfx_data/29264_Swell_36774.reapnes-data",
      "description": "Swell 36774 (4 notes)",
      "notes": "Tags: pulse, staccato, swell, narrow"
    },
    "pulse2": {
      "role": "harmony",
      "preset": "jsfx_data/29265_Swell_36775.reapnes-data",
      "description": "Swell 36775 (4 notes)",
      "notes": "Tags: pulse, staccato, swell, narrow"
    },
    "noise": {
      "role": "percussion",
      "preset": "jsfx_data/48324_Snare_Fade_11563.reapnes-data",
      "description": "Snare Fade 11563 (12 notes)"
    }
  },
  "drum_map": {
    "36": {
      "preset": "jsfx_data/48324_Snare_Fade_11563.reapnes-data",
      "description": "Snare Fade 11563"
    },
    "38": {
      "preset": "jsfx_data/49846_Noise_Swell_11566.reapnes-data",
      "description": "Noise Swell 11566"
    }
  }
}