{
  "format": "reapnes-song-set",
  "version": 1,
  "game": {
    "title": "MegaMan2",
    "platform": "NES"
  },
  "song": {
    "title": "02Title"
  },
  "provenance": {
    "source": "nes-mdb-extracted",
    "confidence": "approximate",
    "notes": "Auto-generated from NES-MDB corpus. 23 presets found. Best-by-note-count selection."
  },
  "channels": {
    "pulse1": {
      "role": "lead",
      "preset": "jsfx_data/1125_Wide_Pad_393.reapnes-data",
      "description": "Wide Pad 393 (26 notes)",
      "notes": "Tags: pulse, short, fade, wide"
    },
    "pulse2": {
      "role": "harmony",
      "preset": "jsfx_data/1357_Thin_Pad_19004.reapnes-data",
      "description": "Thin Pad 19004 (21 notes)",
      "notes": "Tags: pulse, short, fade, looping, thin"
    },
    "noise": {
      "role": "percussion",
      "preset": "jsfx_data/47821_Snare_Fade_10417.reapnes-data",
      "description": "Snare Fade 10417 (526 notes)"
    }
  },
  "drum_map": {
    "36": {
      "preset": "jsfx_data/47821_Snare_Fade_10417.reapnes-data",
      "description": "Snare Fade 10417"
    },
    "38": {
      "preset": "jsfx_data/48110_Snare_Fade_13968.reapnes-data",
      "description": "Snare Fade 13968"
    },
    "42": {
      "preset": "jsfx_data/48150_Snare_Fade_13969.reapnes-data",
      "description": "Snare Fade 13969"
    },
    "46": {
      "preset": "jsfx_data/50213_Snare_Fade_13970.reapnes-data",
      "description": "Snare Fade 13970"
    }
  }
}