{
  "format": "reapnes-song-set",
  "version": 1,
  "game": {
    "title": "MegaMan2",
    "platform": "NES"
  },
  "song": {
    "title": "18DrWilyStage1"
  },
  "provenance": {
    "source": "nes-mdb-extracted",
    "confidence": "approximate",
    "notes": "Auto-generated from NES-MDB corpus. 18 presets found. Best-by-note-count selection."
  },
  "channels": {
    "pulse1": {
      "role": "lead",
      "preset": "jsfx_data/24811_Square_Pad_3680.reapnes-data",
      "description": "Square Pad 3680 (227 notes)",
      "notes": "Tags: pulse, short, fade, looping, square"
    },
    "pulse2": {
      "role": "harmony",
      "preset": "jsfx_data/0432_Square_Pad_25532.reapnes-data",
      "description": "Square Pad 25532 (92 notes)",
      "notes": "Tags: pulse, short, fade, looping, square"
    },
    "noise": {
      "role": "percussion",
      "preset": "jsfx_data/48206_Noise_Swell_11373.reapnes-data",
      "description": "Noise Swell 11373 (17 notes)"
    }
  },
  "drum_map": {
    "36": {
      "preset": "jsfx_data/48206_Noise_Swell_11373.reapnes-data",
      "description": "Noise Swell 11373"
    },
    "38": {
      "preset": "jsfx_data/48450_Noise_Swell_13980.reapnes-data",
      "description": "Noise Swell 13980"
    }
  }
}