{
  "format": "reapnes-song-set",
  "version": 1,
  "game": {
    "title": "MegaMan2",
    "platform": "NES"
  },
  "song": {
    "title": "21Boss"
  },
  "provenance": {
    "source": "nes-mdb-extracted",
    "confidence": "approximate",
    "notes": "Auto-generated from NES-MDB corpus. 12 presets found. Best-by-note-count selection."
  },
  "channels": {
    "pulse1": {
      "role": "lead",
      "preset": "jsfx_data/28316_Thin_Pad_22021.reapnes-data",
      "description": "Thin Pad 22021 (5 notes)",
      "notes": "Tags: pulse, short, fade, looping, thin"
    },
    "pulse2": {
      "role": "harmony",
      "preset": "jsfx_data/29179_Wide_Pad_34506.reapnes-data",
      "description": "Wide Pad 34506 (4 notes)",
      "notes": "Tags: pulse, short, fade, looping, wide"
    },
    "noise": {
      "role": "percussion",
      "preset": "jsfx_data/48794_Noise_Swell_13983.reapnes-data",
      "description": "Noise Swell 13983 (6 notes)"
    }
  },
  "drum_map": {
    "36": {
      "preset": "jsfx_data/48794_Noise_Swell_13983.reapnes-data",
      "description": "Noise Swell 13983"
    },
    "38": {
      "preset": "jsfx_data/49188_Noise_Swell_13982.reapnes-data",
      "description": "Noise Swell 13982"
    },
    "42": {
      "preset": "jsfx_data/50216_Snare_Fade_13984.reapnes-data",
      "description": "Snare Fade 13984"
    },
    "46": {
      "preset": "jsfx_data/52346_Snare_Fade_13985.reapnes-data",
      "description": "Snare Fade 13985"
    }
  }
}